Scenes	Sl. No.	Start_time	End_time	Utterance	Label	Speaker
Scene_7	358	0:16:37.660000	0:00:01.440000	फोन लगाओ ना, यार।	non-humor	Kidnaper's member,u-
Scene_7	359	0:16:39.180000	0:00:01.400000	अरे कितनी बार फोन लगाऊ?	humor	Dilruba,u358
Scene_7	360	0:16:40.620000	0:00:01.640000	पैसा मगाओ ना यार!	non-humor	Kidnaper's member,u359
Scene_7	361a	0:16:43.420000	0:00:01.320000	हे मुझे बोलने देगा!	humor	Kidnaper's boss,u360
Scene_7	361b	0:16:44.790000	0:00:00.830000	बोलो।	non-humor	Kidnaper's member,u361a
Scene_7	362	0:16:46.180000	0:00:02.120000	हैलो, काले कव्वे ।।	non-humor	Keshu,u-
Scene_7	363	0:16:49.060000	0:00:01.840000	केशू जी, थैंक गॉड आप आ गए।	non-humor	Dilruba,u362
Scene_7	364	0:16:51.140000	0:00:01.440000	आप वाकई कितने ब्रेव हो।	non-humor	Dilruba,u362
Scene_7	365	0:16:52.780000	0:00:02.480000	एक मिनट। ये कोकी जी के हसबेंड, केकू जी।	humor	Dilruba,u362
Scene_7	366	0:16:55.420000	0:00:03.200000	और केकू जी, ये यहा का मशहूर बदमाश	non-humor	Dilruba,u362
Scene_7	367	0:16:58.660000	0:00:01.200000	काल कव्वा।	non-humor	Dilruba,u362
Scene_7	368	0:17:00.980000	0:00:01.120000	हैलो, काल कव्वा।	non-humor	Keshu,u366
Scene_7	369	0:17:02.140000	0:00:01.760000	हैलो केकू, माल लाए हो?	non-humor	Kidnaper's boss,u368
Scene_7	370	0:17:03.980000	0:00:03.320000	माल तो क्या रुमाल भी नहीं लाया, पसीना पोछने के लिए।	humor	Keshu,u369
Scene_7	371a	0:17:07.740000	0:00:01.241000	धंधे की बात शुरु करें।	non-humor	Kidnaper's boss,u370
Scene_7	371b	0:17:09.031000	0:00:01.629000	तुम शुरू करो!	non-humor	Keshu,u371a
Scene_7	372	0:17:10.780000	0:00:02.200000	ठीक है। तो 30 लाख रुपया ले के आओ।	non-humor	Kidnaper's boss,u370
Scene_7	373	0:17:13.300000	0:00:01	30 लाख?	humor	Keshu,u372
Scene_7	374a	0:17:14.500000	0:00:02.052000	या या डिस्काउन्टेड रेट बोल रहे हैं।	humor	Dilruba,u373
Scene_7	374b	0:17:16.602000	0:00:00.938000	डिस्काउन्ट?	humor	Keshu,u374a
Scene_7	375	0:17:18.300000	0:00:01.400000	अबे इसका 30 लाख रुपया कौन देगा रे। आ	humor	Keshu,u372
Scene_7	376	0:17:21.060000	0:00:01.400000	इसमें रखा ही क्या है?	humor	Keshu,u372
Scene_7	377	0:17:22.940000	0:00:01.440000	खोखला है ये। खोखला ।	humor	Keshu,u372
Scene_7	378	0:17:26.900000	0:00:01	देखा देखा?	humor	Keshu,u372
Scene_7	379	0:17:28.700000	0:00:02.480000	प्रॉबलम नही प्रॉबलम का भंडार है। ये	humor	Keshu,u372
Scene_7	380	0:17:31.260000	0:00:01.320000	ठीक है ठीक है ..	non-humor	Kidnaper's boss,u379
Scene_7	381	0:17:33.700000	0:00:02.120000	आप बोलो कितना देना है?	non-humor	Kidnaper's boss,u379
Scene_7	382	0:17:39.460000	0:00:01.200000	100 का छुट्ठा है। दो 50	humor	Keshu,u381
Scene_7	383	0:17:41.700000	0:00:01	दो 50 के?	non-humor	Keshu,u381
Scene_7	384	0:17:42.740000	0:00:02.320000	अरे 1000 रुपया तो इसके खाने पर खर्च किया है।	humor	Kidnaper's boss,u383
Scene_7	385	0:17:46.940000	0:00:02.080000	चाय कॉफी भी टाइम पर देते थे, यू नो।	non-humor	Dilruba,u384
Scene_7	386	0:17:49.100000	0:00:02.120000	उपर से लस्सी मांग रहा था मैंगो इन।	humor	Kidnaper's boss,u385
Scene_7	387	0:17:51.300000	0:00:03.360000	ठीक है! ठीक है। ठीक है। आई विल हैंडल दिस। आई विल हैंडल दिस। ओके	non-humor	Keshu,u386
Scene_7	388	0:17:55.300000	0:00:01.200000	अरे, चिरकुट चुप।	humor	Keshu,u386
Scene_7	389	0:17:58.060000	0:00:03.040000	1000 रुपया दूंगा फुल एण्ड फाइनल कर डोलो वो भी चेक से।	non-humor	Keshu,u386
Scene_7	390	0:18:01.380000	0:00:01.720000	चलता है तो बोलो वरना गोली मार दो। चलो	humor	Keshu,u386
Scene_7	391	0:18:03.340000	0:00:04.200000	केकू जी, आप मुझे यहां छुड़वाने आए हैं या मरवाने आए हैं?	non-humor	Dilruba,u390
Scene_7	392	0:18:07.620000	0:00:01.520000	शट अप शट अप शट अप..	non-humor	Keshu,u391
Scene_7	393	0:18:09.340000	0:00:02.520000	पता है तुम्हारी वजह से, प्रेमा जी  कितनी अपसेट हो गई हैं, ?	humor	Keshu,u391
Scene_7	394a	0:18:12.780000	0:00:00.896000	बोलो क्या तय किया?	non-humor	Keshu,u391
Scene_7	394b	0:18:13.726000	0:00:00.974000	ठीक है।	non-humor	Kidnaper's boss,u394a
Scene_7	395a	0:18:15.380000	0:00:00.988000	मैं फाइनल ऑफर देता हूं।	non-humor	Kidnaper's boss,u394a
Scene_7	395b	0:18:16.418000	0:00:00.522000	बोलो।	non-humor	Keshu,u395a
Scene_7	396	0:18:17.020000	0:00:03.040000	5 लाख रुपया! वरना..	non-humor	Kidnaper's boss,u395b
Scene_7	397	0:18:21.060000	0:00:02.480000	बॉस, वो उंगली है।	humor	Kidnaper's member,u396
Scene_7	398	0:18:23.780000	0:00:01.600000	असली बंदूक इधर है। ये लो	humor	Kidnaper's member,u396
Scene_7	399	0:18:29.060000	0:00:03.520000	के केकू जी ये असली बंदूक है और इसमे असली गोली भी है, हां।	humor	Dilruba,u398
Scene_7	400	0:18:33.300000	0:00:03.080000	ओके ओके ओके	humor	Keshu,u399
Scene_7	401	0:18:38.460000	0:00:01.560000	मैं दस मिनट में आता हूं।	non-humor	Keshu,u399
Scene_7	402	0:18:40.340000	0:00:04.480000	अगर दस मिनट में नहीं पहुचे तो बाहर ही गोली की आवाज सुन लेना।	humor	Kidnaper's boss,u401
Scene_7	403	0:18:45.350000	0:00:03.480000	केकू जी आप क्यू ऐसा ओवर स्मार्ट बन रहे हैं?	non-humor	Dilruba,u402
Scene_7	404	0:18:49.360000	0:00:01.850000	अगर मैं मर गया तो मेरा क्या होगा?	non-humor	Dilruba,u402
Scene_7	405	0:18:51.570000	0:00:01.280000	अंतिम संस्सकार होगा।	humor	Keshu,u404
Scene_7	406	0:18:55.380000	0:00:01.480000	दस मिनट	non-humor	Keshu,u402
Scene_7	407	0:19:01.310000	0:00:03.160000	गोखले गोखले गोखले ..ये मेरे से क्या हो गया	humor	Keshu,u-
Scene_7	408	0:19:05.320000	0:00:02.160000	मेरे अंदर इतनी ताकत कहां से आ गई ..। गोखले	non-humor	Keshu,u-
Scene_7	409	0:19:08.330000	0:00:02.160000	आई नो आई नो .. वो लोगो ने तुझसे 5 लाख रुपये मागे हैं। राइट ?	non-humor	Gokhale,u408
Scene_7	410	0:19:10.840000	0:00:02.260000	लेकिन 10 मिनट में 5 लाख रुपया कहां से ले के आएंगे।	non-humor	Keshu,u409
Scene_7	411	0:19:13.350000	0:00:01.160000	टेंशन मत ले, मेरे दोस्त।	non-humor	Gokhale,u410
Scene_7	412	0:19:14.790000	0:00:02.880000	ये ले। ले के जा और बोल। इसमें 5 लाख रुपये हैं।	humor	Gokhale,u410
Scene_7	413a	0:19:17.790000	0:00:00.613333	इसमे हैं?	humor	Keshu,u412
Scene_7	413b	0:19:18.453333	0:00:01.176667	अरे तू जा रे..	humor	Gokhale,u413a
Scene_7	414	0:19:19.870000	0:00:01.120000	मैं जातो रे बाबा..	non-humor	Keshu,u413b
Scene_7	415	0:19:21.230000	0:00:03	ए सुन, वापस ऐसे जाएगा क्या?	non-humor	Gokhale,u414
Scene_7	416	0:19:33.630000	0:00:01.040000	राउन्ड फीगर ?	non-humor	Keshu,u396
Scene_7	417	0:19:34.790000	0:00:01.440000	पुरे 5 लाख । गिन लो?	humor	Keshu,u396
Scene_7	418a	0:19:45.230000	0:00:00.720000	तुम कौन हो?	non-humor	Kidnaper's boss,u-
Scene_7	418b	0:19:46	0:00:01.030000	गोख ।।	non-humor	Dilruba,u418a
Scene_7	419	0:19:49.030000	0:00:02.200000	अपुन सफेद बगुला!	humor	Gokhale,u418b
Scene_7	420	0:19:52.430000	0:00:03.280000	पुलिस ने अपुन पर 50 लाख का इनाम रखा है। समझा?	humor	Gokhale,u418b
Scene_7	421	0:19:57.470000	0:00:01.840000	अपने से ज्यादा है।	humor	Kidnaper's boss,u420
Scene_7	422	0:19:59.390000	0:00:03	अरे, तुम्हारा सीनियर है। सलाम ठोक।	non-humor	Keshu,u421
Scene_7	423	0:20:03.110000	0:00:03	हिलना मत! उसमें बम है।	humor	Gokhale,u422
Scene_7	424	0:20:08.310000	0:00:01.320000	हिलने से फटता है।	non-humor	Gokhale,u422
Scene_7	425	0:20:10.270000	0:00:01.120000	हिला तो फटा।	humor	Gokhale,u422
Scene_7	426	0:20:11.470000	0:00:02.680000	चलो चलो। हिलना मत! हिलना मत!	non-humor	Keshu,u425
Scene_7	427	0:20:14.630000	0:00:01.040000	हिलना मत।	humor	Dilruba,u426
Scene_7	428	0:20:15.830000	0:00:02.720000	दिलरुबा जी, हां! अपना 50 परसेन्ट तो लेके जाओ?	non-humor	Kidnaper's boss,u427
Scene_7	429	0:20:18.590000	0:00:01.400000	नहीं नही वो रख लेना रख लेना।	humor	Dilruba,u428
Scene_7	430	0:20:20.070000	0:00:01.560000	बाय सीरियल मैं आने के बाद बताता हूँ ।।	non-humor	Dilruba,u428
Scene_7	431	0:20:21.670000	0:00:02.320000	सुचिता चोपड़ा को देख लेना।	humor	Kidnaper's member,u430
Scene_7	432	0:20:26.590000	0:00:02.320000	बच गए कुलकर्णी, बच गए ।।	non-humor	Gokhale,u431
Scene_7	433	0:20:28.990000	0:00:03.120000	काई का कुलकर्णी काई का बच गया ? पागल है तू?	humor	Keshu,u432
Scene_7	434	0:20:32.430000	0:00:01.600000	अरे बम का आइडिया कहां से ले के आया?	non-humor	Keshu,u432
Scene_7	435	0:20:34.350000	0:00:02	और वो छोड़ बम कहाँ से लाया? अगर फट जाता तो ?	non-humor	Keshu,u432
Scene_7	436	0:20:36.430000	0:00:02.480000	काई रे, मेरे पास बम कहां से आएगा?	humor	Gokhale,u432
Scene_7	437	0:20:38.990000	0:00:01.840000	उसमें नारियल था नारियल।	non-humor	Gokhale,u432
Scene_7	438	0:20:41.070000	0:00:01.200000	वाह!	non-humor	Dilruba,u437